{
  "schema_version": "v1",
  "response_type": "ingestion_job_catalog_page",
  "request_id": "99999999-9999-4999-8999-999999999999",
  "tenant_id": "11111111-1111-4111-8111-111111111111",
  "items": [
    {
      "job_id": "45454545-4545-4454-8454-454545454545",
      "document_version_id": "34343434-3434-4343-8343-343434343434",
      "status": "retry_wait",
      "attempt_count": 1,
      "max_attempts": 3,
      "available_at": "2026-07-21T23:05:00.000Z",
      "started_at": null,
      "finished_at": null,
      "last_error_code": "embedding_provider_timeout",
      "last_error_retryable": true,
      "created_at": "2026-07-21T22:50:00.000Z",
      "updated_at": "2026-07-21T22:55:00.000Z"
    }
  ],
  "next_cursor": null,
  "provenance": {
    "source_product": "la_muni_rag",
    "generated_by": "system",
    "created_at": "2026-07-21T23:00:00.000Z",
    "source_refs": [
      "45454545-4545-4454-8454-454545454545"
    ],
    "credential_id": "66666666-6666-4666-8666-666666666666",
    "audit_id": "abababab-abab-4bab-8bab-abababababab"
  }
}
